USER_ID,USERNAME,TASK_COMPLETED_STATUS,TASK_TITLE
1,Antonette,False,delectus aut autem
1,Antonette,False,quis ut nam facilis et officia qui
1,Antonette,False,fugiat veniam minus
1,Antonette,True,et porro tempora
1,Antonette,False,laboriosam mollitia et enim quasi adipisci quia provident illum
1,Antonette,False,qui ullam ratione quibusdam voluptatem quia omnis
1,Antonette,False,illo expedita consequatur quia in
1,Antonette,True,quo adipisci enim quam ut ab
1,Antonette,False,molestiae perspiciatis ipsa
1,Antonette,True,illo est ratione doloremque quia maiores aut
1,Antonette,True,vero rerum temporibus dolor
1,Antonette,True,ipsa repellendus fugit nisi
1,Antonette,False,et doloremque nulla
1,Antonette,True,repellendus sunt dolores architecto voluptatum
1,Antonette,True,ab voluptatum amet voluptas
1,Antonette,True,accusamus eos facilis sint et aut voluptatem
1,Antonette,True,quo laboriosam deleniti aut qui
1,Antonette,False,dolorum est consequatur ea mollitia in culpa
1,Antonette,True,molestiae ipsa aut voluptatibus pariatur dolor nihil
1,Antonette,True,ullam nobis libero sapiente ad optio sint
2,Antonette,False,suscipit repellat esse quibusdam voluptatem incidunt
2,Antonette,True,distinctio vitae autem nihil ut molestias quo
2,Antonette,False,et itaque necessitatibus maxime molestiae qui quas velit
2,Antonette,False,adipisci non ad dicta qui amet quaerat doloribus ea
2,Antonette,True,voluptas quo tenetur perspiciatis explicabo natus
2,Antonette,True,aliquam aut quasi
2,Antonette,True,veritatis pariatur delectus
2,Antonette,False,nesciunt totam sit blanditiis sit
2,Antonette,False,laborum aut in quam
2,Antonette,True,nemo perspiciatis repellat ut dolor libero commodi blanditiis omnis
2,Antonette,False,repudiandae totam in est sint facere fuga
2,Antonette,False,earum doloribus ea doloremque quis
2,Antonette,False,sint sit aut vero
2,Antonette,False,porro aut necessitatibus eaque distinctio
2,Antonette,True,repellendus veritatis molestias dicta incidunt
2,Antonette,True,excepturi deleniti adipisci voluptatem et neque optio illum ad
2,Antonette,False,sunt cum tempora
2,Antonette,False,totam quia non
2,Antonette,False,doloremque quibusdam asperiores libero corrupti illum qui omnis
2,Antonette,True,totam atque quo nesciunt
3,Antonette,False,aliquid amet impedit consequatur aspernatur placeat eaque fugiat suscipit
3,Antonette,False,rerum perferendis error quia ut eveniet
3,Antonette,True,tempore ut sint quis recusandae
3,Antonette,True,cum debitis quis accusamus doloremque ipsa natus sapiente omnis
3,Antonette,False,velit soluta adipisci molestias reiciendis harum
3,Antonette,False,vel voluptatem repellat nihil placeat corporis
3,Antonette,False,nam qui rerum fugiat accusamus
3,Antonette,False,sit reprehenderit omnis quia
3,Antonette,False,ut necessitatibus aut maiores debitis officia blanditiis velit et
3,Antonette,True,cupiditate necessitatibus ullam aut quis dolor voluptate
3,Antonette,False,distinctio exercitationem ab doloribus
3,Antonette,False,nesciunt dolorum quis recusandae ad pariatur ratione
3,Antonette,False,qui labore est occaecati recusandae aliquid quam
3,Antonette,True,quis et est ut voluptate quam dolor
3,Antonette,True,voluptatum omnis minima qui occaecati provident nulla voluptatem ratione
3,Antonette,True,deleniti ea temporibus enim
3,Antonette,False,pariatur et magnam ea doloribus similique voluptatem rerum quia
3,Antonette,False,est dicta totam qui explicabo doloribus qui dignissimos
3,Antonette,False,perspiciatis velit id laborum placeat iusto et aliquam odio
3,Antonette,True,et sequi qui architecto ut adipisci
4,Antonette,True,odit optio omnis qui sunt
4,Antonette,False,et placeat et tempore aspernatur sint numquam
4,Antonette,True,doloremque aut dolores quidem fuga qui nulla
4,Antonette,False,voluptas consequatur qui ut quia magnam nemo esse
4,Antonette,False,fugiat pariatur ratione ut asperiores necessitatibus magni
4,Antonette,False,rerum eum molestias autem voluptatum sit optio
4,Antonette,False,quia voluptatibus voluptatem quos similique maiores repellat
4,Antonette,False,aut id perspiciatis voluptatem iusto
4,Antonette,False,doloribus sint dolorum ab adipisci itaque dignissimos aliquam suscipit
4,Antonette,False,ut sequi accusantium et mollitia delectus sunt
4,Antonette,False,aut velit saepe ullam
4,Antonette,False,praesentium facilis facere quis harum voluptatibus voluptatem eum
4,Antonette,True,sint amet quia totam corporis qui exercitationem commodi
4,Antonette,False,expedita tempore nobis eveniet laborum maiores
4,Antonette,False,occaecati adipisci est possimus totam
4,Antonette,True,sequi dolorem sed
4,Antonette,False,maiores aut nesciunt delectus exercitationem vel assumenda eligendi at
4,Antonette,False,reiciendis est magnam amet nemo iste recusandae impedit quaerat
4,Antonette,True,eum ipsa maxime ut
4,Antonette,True,tempore molestias dolores rerum sequi voluptates ipsum consequatur
5,Antonette,True,suscipit qui totam
5,Antonette,False,voluptates eum voluptas et dicta
5,Antonette,True,quidem at rerum quis ex aut sit quam
5,Antonette,False,sunt veritatis ut voluptate
5,Antonette,True,et quia ad iste a
5,Antonette,True,incidunt ut saepe autem
5,Antonette,True,laudantium quae eligendi consequatur quia et vero autem
5,Antonette,False,vitae aut excepturi laboriosam sint aliquam et et accusantium
5,Antonette,True,sequi ut omnis et
5,Antonette,True,molestiae nisi accusantium tenetur dolorem et
5,Antonette,True,nulla quis consequatur saepe qui id expedita
5,Antonette,True,in omnis laboriosam
5,Antonette,True,odio iure consequatur molestiae quibusdam necessitatibus quia sint
5,Antonette,False,facilis modi saepe mollitia
5,Antonette,True,vel nihil et molestiae iusto assumenda nemo quo ut
5,Antonette,False,nobis suscipit ducimus enim asperiores voluptas
5,Antonette,False,dolorum laboriosam eos qui iure aliquam
5,Antonette,True,debitis accusantium ut quo facilis nihil quis sapiente necessitatibus
5,Antonette,False,neque voluptates ratione
5,Antonette,False,excepturi a et neque qui expedita vel voluptate
6,Antonette,False,explicabo enim cumque porro aperiam occaecati minima
6,Antonette,False,sed ab consequatur
6,Antonette,False,non sunt delectus illo nulla tenetur enim omnis
6,Antonette,False,excepturi non laudantium quo
6,Antonette,True,totam quia dolorem et illum repellat voluptas optio
6,Antonette,True,ad illo quis voluptatem temporibus
6,Antonette,False,praesentium facilis omnis laudantium fugit ad iusto nihil nesciunt
6,Antonette,True,a eos eaque nihil et exercitationem incidunt delectus
6,Antonette,True,autem temporibus harum quisquam in culpa
6,Antonette,True,aut aut ea corporis
6,Antonette,False,magni accusantium labore et id quis provident
6,Antonette,False,consectetur impedit quisquam qui deserunt non rerum consequuntur eius
6,Antonette,False,quia atque aliquam sunt impedit voluptatum rerum assumenda nisi
6,Antonette,False,cupiditate quos possimus corporis quisquam exercitationem beatae
6,Antonette,False,sed et ea eum
6,Antonette,True,ipsa dolores vel facilis ut
6,Antonette,False,sequi quae est et qui qui eveniet asperiores
6,Antonette,False,quia modi consequatur vero fugiat
6,Antonette,False,corporis ducimus ea perspiciatis iste
6,Antonette,False,dolorem laboriosam vel voluptas et aliquam quasi
7,Antonette,True,inventore aut nihil minima laudantium hic qui omnis
7,Antonette,True,provident aut nobis culpa
7,Antonette,False,esse et quis iste est earum aut impedit
7,Antonette,False,qui consectetur id
7,Antonette,False,aut quasi autem iste tempore illum possimus
7,Antonette,True,ut asperiores perspiciatis veniam ipsum rerum saepe
7,Antonette,True,voluptatem libero consectetur rerum ut
7,Antonette,False,eius omnis est qui voluptatem autem
7,Antonette,False,rerum culpa quis harum
7,Antonette,True,nulla aliquid eveniet harum laborum libero alias ut unde
7,Antonette,False,qui ea incidunt quis
7,Antonette,True,qui molestiae voluptatibus velit iure harum quisquam
7,Antonette,True,et labore eos enim rerum consequatur sunt
7,Antonette,False,molestiae doloribus et laborum quod ea
7,Antonette,False,facere ipsa nam eum voluptates reiciendis vero qui
7,Antonette,False,asperiores illo tempora fuga sed ut quasi adipisci
7,Antonette,False,qui sit non
7,Antonette,True,placeat minima consequatur rem qui ut
7,Antonette,False,consequatur doloribus id possimus voluptas a voluptatem
7,Antonette,True,aut consectetur in blanditiis deserunt quia sed laboriosam
8,Antonette,True,explicabo consectetur debitis voluptates quas quae culpa rerum non
8,Antonette,True,maiores accusantium architecto necessitatibus reiciendis ea aut
8,Antonette,False,eum non recusandae cupiditate animi
8,Antonette,False,ut eum exercitationem sint
8,Antonette,False,beatae qui ullam incidunt voluptatem non nisi aliquam
8,Antonette,True,molestiae suscipit ratione nihil odio libero impedit vero totam
8,Antonette,True,eum itaque quod reprehenderit et facilis dolor autem ut
8,Antonette,False,esse quas et quo quasi exercitationem
8,Antonette,False,animi voluptas quod perferendis est
8,Antonette,False,eos amet tempore laudantium fugit a
8,Antonette,True,accusamus adipisci dicta qui quo ea explicabo sed vero
8,Antonette,False,odit eligendi recusandae doloremque cumque non
8,Antonette,False,ea aperiam consequatur qui repellat eos
8,Antonette,True,rerum non ex sapiente
8,Antonette,True,voluptatem nobis consequatur et assumenda magnam
8,Antonette,True,nam quia quia nulla repellat assumenda quibusdam sit nobis
8,Antonette,True,dolorem veniam quisquam deserunt repellendus
8,Antonette,True,debitis vitae delectus et harum accusamus aut deleniti a
8,Antonette,True,debitis adipisci quibusdam aliquam sed dolore ea praesentium nobis
8,Antonette,False,et praesentium aliquam est
9,Antonette,True,ex hic consequuntur earum omnis alias ut occaecati culpa
9,Antonette,True,omnis laboriosam molestias animi sunt dolore
9,Antonette,False,natus corrupti maxime laudantium et voluptatem laboriosam odit
9,Antonette,False,reprehenderit quos aut aut consequatur est sed
9,Antonette,False,fugiat perferendis sed aut quidem
9,Antonette,False,quos quo possimus suscipit minima ut
9,Antonette,False,et quis minus quo a asperiores molestiae
9,Antonette,False,recusandae quia qui sunt libero
9,Antonette,True,ea odio perferendis officiis
9,Antonette,False,quisquam aliquam quia doloribus aut
9,Antonette,True,fugiat aut voluptatibus corrupti deleniti velit iste odio
9,Antonette,False,et provident amet rerum consectetur et voluptatum
9,Antonette,False,harum ad aperiam quis
9,Antonette,False,similique aut quo
9,Antonette,True,laudantium eius officia perferendis provident perspiciatis asperiores
9,Antonette,False,magni soluta corrupti ut maiores rem quidem
9,Antonette,False,et placeat temporibus voluptas est tempora quos quibusdam
9,Antonette,True,nesciunt itaque commodi tempore
9,Antonette,True,omnis consequuntur cupiditate impedit itaque ipsam quo
9,Antonette,True,debitis nisi et dolorem repellat et
10,Antonette,False,ut cupiditate sequi aliquam fuga maiores
10,Antonette,True,inventore saepe cumque et aut illum enim
10,Antonette,True,omnis nulla eum aliquam distinctio
10,Antonette,False,molestias modi perferendis perspiciatis
10,Antonette,False,voluptates dignissimos sed doloribus animi quaerat aut
10,Antonette,False,explicabo odio est et
10,Antonette,False,consequuntur animi possimus
10,Antonette,True,vel non beatae est
10,Antonette,True,culpa eius et voluptatem et
10,Antonette,True,accusamus sint iusto et voluptatem exercitationem
10,Antonette,True,temporibus atque distinctio omnis eius impedit tempore molestias pariatur
10,Antonette,False,ut quas possimus exercitationem sint voluptates
10,Antonette,True,rerum debitis voluptatem qui eveniet tempora distinctio a
10,Antonette,False,sed ut vero sit molestiae
10,Antonette,True,rerum ex veniam mollitia voluptatibus pariatur
10,Antonette,True,consequuntur aut ut fugit similique
10,Antonette,True,dignissimos quo nobis earum saepe
10,Antonette,True,quis eius est sint explicabo
10,Antonette,True,numquam repellendus a magnam
10,Antonette,False,ipsam aperiam voluptates qui
